{
  "contract": {
    "schema": "cad-file-reader/v0",
    "source": "qto-demo-self-drawn.dxf",
    "origin_schema": "cad-sample-qto/v1",
    "summary": {
      "total": 3,
      "confirmed_evidence": 3,
      "inferred_candidate": 0,
      "review_required": 0,
      "candidate_count": 3,
      "duplicate_candidate": 0
    },
    "review_reasons": [
      "missing_scale",
      "missing_unit",
      "missing_layer",
      "missing_block_definition",
      "ambiguous_text_binding",
      "geometry_conflict",
      "duplicate_candidate",
      "outside_viewport",
      "incomplete_geometry",
      "low_confidence_inference"
    ],
    "candidates": [
      {
        "id": "sample-candidates-001",
        "kind": "text",
        "value": null,
        "unit": null,
        "layer": "TITLE",
        "block_name": null,
        "text": "示例一层平面图",
        "bbox": null,
        "evidence": [],
        "method": "views",
        "confidence": 0.95,
        "confidence_score": 0.95,
        "confidence_tier": "confirmed_evidence",
        "review_reasons": [],
        "review_notes": "",
        "source_schema": "cad-file-reader/v0",
        "source_id": "view-1-normal",
        "final_quantity": false,
        "origin_schema": "cad-sample-qto/v1",
        "section": "views",
        "source_file": "qto-demo-self-drawn.dxf",
        "status": "candidate",
        "rotation": null,
        "discipline_refs": [],
        "confidence_scores": {}
      },
      {
        "id": "sample-candidates-002",
        "kind": "text",
        "value": null,
        "unit": null,
        "layer": "TITLE",
        "block_name": null,
        "text": "示例二层平面图",
        "bbox": null,
        "evidence": [],
        "method": "views",
        "confidence": 0.9,
        "confidence_score": 0.9,
        "confidence_tier": "confirmed_evidence",
        "review_reasons": [],
        "review_notes": "",
        "source_schema": "cad-file-reader/v0",
        "source_id": "view-2-normal",
        "final_quantity": false,
        "origin_schema": "cad-sample-qto/v1",
        "section": "views",
        "source_file": "qto-demo-self-drawn.dxf",
        "status": "candidate",
        "rotation": null,
        "discipline_refs": [],
        "confidence_scores": {}
      },
      {
        "id": "sample-candidates-003",
        "kind": "room",
        "value": null,
        "unit": null,
        "layer": "ROOM",
        "block_name": null,
        "text": null,
        "bbox": null,
        "evidence": [],
        "method": "rooms",
        "confidence": 0.92,
        "confidence_score": 0.92,
        "confidence_tier": "confirmed_evidence",
        "review_reasons": [],
        "review_notes": "",
        "source_schema": "cad-file-reader/v0",
        "source_id": "room-1-demo",
        "final_quantity": false,
        "origin_schema": "cad-sample-qto/v1",
        "section": "rooms",
        "source_file": "qto-demo-self-drawn.dxf",
        "status": "candidate",
        "rotation": null,
        "discipline_refs": [],
        "confidence_scores": {}
      }
    ],
    "review_candidates": [],
    "boundary": "识图候选与测量候选，final_quantity=false；不输出最终工程量、材料量、造价或结算量。"
  },
  "qto_spec": "qto-project/v1",
  "qto_version": "0.1.0",
  "project_key": {
    "project": "自绘样例",
    "building": "示例楼",
    "floor": "",
    "zone": "",
    "room": "",
    "specialty": "cad-file-reader",
    "source": "explicit",
    "review_required": false
  },
  "specialty": "cad-file-reader",
  "draft_type": "draft_type_pending",
  "placeholder": null,
  "producer": {
    "skill": "cad-file-reader",
    "role": "recognition"
  }
}